Category,Question#,Title,Detail_lesson,School
Knowledge Management,1,"INSTITUTIONALIZING TRIBAL KNOWLEDGE","Large organizations often struggle with knowledge silos where critical insights remain trapped within individual teams or departments. When high-performing teams develop effective practices, these learnings rarely scale across the enterprise. Consider the challenge of capturing not just the 'what' but the 'why' behind successful approaches. How do you create systematic mechanisms for knowledge transfer that go beyond documentation? Think about incentive structures, cultural barriers, and the balance between standardization and local adaptation.","School of Organizational Development"
Project Recovery,2,"STRATEGIC INTERVENTION FOR FAILING INITIATIVES","When enterprise projects show early warning signs of failure—budget overruns, missed milestones, stakeholder dissatisfaction—decisive leadership intervention becomes critical. The natural tendency is either to double-down with more resources or to quietly wind down the effort. Neither approach addresses root causes or recovers invested value. Consider diagnostic frameworks for distinguishing between execution problems versus fundamental strategic misalignment. What systematic approach would you use to assess whether a struggling initiative can be salvaged?","School of Strategic Management"
Cross-Functional Collaboration,3,"BREAKING DOWN ORGANIZATIONAL SILOS","Matrix organizations create complexity where employees serve multiple masters and competing priorities emerge between functional and project leadership. Traditional hierarchy breaks down when critical initiatives require seamless collaboration across business units that operate with different metrics, timelines, and cultural norms. The challenge extends beyond process design to fundamental questions of accountability and resource allocation. How do you align incentives and create shared ownership when individual performance reviews still happen within functional silos?","School of Organizational Behavior"
Change Management,4,"OVERCOMING ORGANIZATIONAL INERTIA","Large enterprises develop immune systems that resist change, even when current approaches are demonstrably suboptimal. Middle management often becomes the antibody that neutralizes transformation efforts, not out of malice but from legitimate concerns about operational stability and their own competency in new paradigms. The challenge is creating urgency without crisis and building coalition among stakeholders who benefit from the status quo. What systematic approach would you design to diagnose and address the cultural barriers preventing necessary organizational evolution?","School of Change Leadership"
Resource Allocation,5,"PORTFOLIO PRIORITIZATION IN RESOURCE-CONSTRAINED ENVIRONMENTS","Every large organization faces the challenge of saying 'no' to good ideas while ensuring the best opportunities receive adequate investment. Traditional budgeting processes often perpetuate historical allocations rather than optimizing for future value creation. The complexity multiplies when considering interdependencies between initiatives and the need to maintain operational excellence while funding innovation. How do you create transparent, defensible frameworks for resource allocation that balance short-term performance with long-term strategic positioning?","School of Strategic Planning"
Performance Management,6,"SCALING HIGH-PERFORMANCE TEAM DYNAMICS","High-performing teams exhibit distinct characteristics—psychological safety, clear accountability, shared purpose—but these dynamics prove difficult to replicate at scale. What works for a 10-person startup team often breaks down in a 100-person division, and becomes unrecognizable in a 10,000-person enterprise. The challenge is maintaining the essence of high performance while adapting to the realities of size, complexity, and regulatory requirements. How do you systematically identify and scale the cultural elements that drive exceptional team performance?","School of Team Effectiveness"
Innovation Management,7,"BALANCING INNOVATION WITH OPERATIONAL EXCELLENCE","Established organizations excel at optimizing existing operations but struggle to innovate at the pace required by changing market conditions. The skills, processes, and metrics that drive operational excellence often conflict with the ambiguity and risk-taking required for breakthrough innovation. Creating separate innovation labs often leads to isolation from core business realities. How do you design organizational structures and incentives that simultaneously reward efficiency in core operations and experimentation in emerging opportunities?","School of Innovation Strategy"
Stakeholder Alignment,8,"MANAGING COMPETING STAKEHOLDER INTERESTS","Large organizations serve multiple constituencies—shareholders, employees, customers, regulators, communities—whose interests often conflict. Senior leaders must navigate these tensions while maintaining organizational coherence and strategic focus. The challenge intensifies when stakeholder expectations evolve faster than organizational capabilities can adapt. How do you create systematic approaches for stakeholder engagement that build sustainable alignment without compromising strategic decision-making autonomy?","School of Stakeholder Management"
Talent Development,9,"DEVELOPING NEXT-GENERATION LEADERSHIP CAPABILITY","Most large organizations promote high-performing individual contributors into leadership roles without systematic preparation for the fundamentally different skill requirements of leading at scale. The transition from managing tasks to leading people, from executing strategy to setting direction, requires capabilities rarely developed through traditional career progression. How do you design leadership development programs that prepare high-potential employees for the ambiguity and complexity of senior organizational roles?","School of Leadership Development"
Digital Transformation,10,"ORCHESTRATING ENTERPRISE-WIDE TECHNOLOGY MODERNIZATION","Digital transformation initiatives often fail because they focus on technology implementation rather than organizational capability development. Legacy systems, established workflows, and embedded skill sets create resistance to new digital processes. The challenge is sequencing technology adoption, process redesign, and cultural change to minimize disruption while maximizing value realization. How do you design transformation roadmaps that balance the urgency of competitive positioning with the practical realities of organizational change management?","School of Digital Strategy"